<?xml version="1.0" encoding="UTF-8"?>
<station xmlns="station" id="ST01" description="Station 1 (Work Unit)" resourceType="equipment" level="work_unit" sn="KR3-R540-001" physicalLocation="researchLab,productionLine1" xmlns:xsi="http://www.w3.org/2001/XMLSchema-instance" xsi:schemaLocation="station ../Station.xsd">
<palletIn id="PI1_ST01" xPos="80" yPos="80" zPos="50"/>
		<palletIn id="PI2_ST01" xPos="520" yPos="80" zPos="50"/>
		<palletOut id="PO1_ST01" xPos="620" yPos="380" zPos="50"/>
		<buffer id="B1_ST01" description="Buffer 1 contains bearings" current="10" max="10" warning="5" xPos="220" yPos="580" zPos="40" consumable_id="C1_B1_ST01">
			<consumable id="C1_B1_ST01" description="Lower Bearing" type="bearing" resourceType="material"/>
		</buffer>
		<buffer id="B2_ST01" description="Buffer 2 contains bearings" current="10" max="10" warning="5" xPos="320" yPos="580" zPos="40" consumable_id="C2_B2_ST01">
			<consumable id="C2_B2_ST01" description="Higher Bearing" type="bearing" resourceType="material"/>
		</buffer>
		<buffer id="B3_ST01" description="Buffer 3 contains axes" current="10" max="10" warning="5" xPos="420" yPos="580" zPos="40" consumable_id="C3_B3_ST01">
			<consumable id="C3_B3_ST01" description="Shaft" type="axle" resourceType="material"/>
		</buffer>
		<buffer id="B4_ST01" description="Buffer 4 contains covers" current="10" max="10" warning="5" xPos="520" yPos="580" zPos="40" consumable_id="C4_B4_ST01">
			<consumable id="C4_B4_ST01" description="Cover" type="cover" resourceType="material"/>
		</buffer>
		<tool id="T1_ST01" type="gripper" changeoverT="00:15:00" description="Double gripper"/>
		<simple_operation id="S_01" type="place_cover" executionTime="00:00:05"/>
		<simple_operation id="S_02" type="insert_axis" executionTime="00:00:10"/>
		<simple_operation id="S_03" type="insert_and_place" executionTime="00:00:20"/>
		<complex_operation id="C_01" type="assembly" executionTime="00:00:10"/>
</station>
