<?xml version="1.0" encoding="UTF-8"?>
<station xmlns="station" id="ST03" description="Station_3_Work_Unit" resourceType="equipment" level="work_unit" sn="KR3-R540-002" physicalLocation="researchLab,productionLine3" xmlns:xsi="http://www.w3.org/2001/XMLSchema-instance" xsi:schemaLocation="station ../Station.xsd">
	<palletIn id="PI1_ST03" xPos="80" yPos="80" zPos="50"/>
		<palletIn id="PI2_ST03" xPos="520" yPos="80" zPos="50"/>
		<palletOut id="PO1_ST03" xPos="620" yPos="380" zPos="50"/>
		<buffer id="B1_ST03" description="Buffer 1 contains covers" current="10" max="10" warning="5" xPos="520" yPos="580" zPos="40" consumable_id="C1_B1_ST03">
			<consumable id="C1_B1_ST03" description="Cover" type="cover" resourceType="material"/>
		</buffer>
		<tool id="T1_ST03" type="gripper" changeoverT="00:15:00" description="Simple gripper"/>
		<simple_operation id="S_01" type="place_cover" executionTime="00:00:05"/>
		<complex_operation id="C_01" type="assembly" executionTime="00:00:10"/>
</station>
