<?xml version="1.0" encoding="UTF-8"?>
<station xmlns="station" id="31" description="Station 3 only has covers as consumable materials" xmlns:xsi="http://www.w3.org/2001/XMLSchema-instance" xsi:schemaLocation="station ./Station.xsd">
	<palletIn id="PI1_ST_03" xPos="80" yPos="80" zPos="50"/>
	<palletIn id="PI2_ST_03" xPos="520" yPos="80" zPos="50"/>
	<palletOut id="PO1_ST_03" xPos="620" yPos="380" zPos="50"/>
	<buffer id="B1_ST_03" description="Buffer 1 contains covers" current="10" max="10" warning="5" xPos="520" yPos="580" zPos="40" consumable_id="C1_B1_ST_03">
		<consumable id="C1_B1_ST_03" description="Cover" type="cover"/>
	</buffer>
	<tool id="T1_ST_03" type="gripper" changeoverT="00:15:00" description="Simple gripper"/>
	<simple_operation id="10" executionTime="00:00:15">
		<action id="4" type="pick_and_place" actionPos="4" description="place cover">
			<consumable id="C" description="Cover" type="cover"/>
		</action>
	</simple_operation>
</station>
